[
  {
    "id": "m-temoin-physique-chimie-concentration",
    "chapitre": "temoin-physique-chimie",
    "notion": "n-temoin-physique-chimie-alpha",
    "genre": "formule",
    "titre": "Carte d'essai (formule avec unités)",
    "enonce": "Énoncé d'essai : $c = \\dfrac{n}{V}$.",
    "conditions": "Condition d'essai.",
    "simplifie": {
      "coeur": "$c = \\dfrac{n}{V}$",
      "motCle": "essai-concentration"
    }
  }
]
