[
  {
    "id": "m-temoin-maths-alpha",
    "chapitre": "temoin-maths",
    "notion": "n-temoin-maths-alpha",
    "genre": "definition",
    "titre": "Carte d'essai (définition)",
    "enonce": "Énoncé d'essai d'une carte du mémo : $u_{n+1} = 2u_n + 1$.",
    "conditions": "Condition d'essai : pour tout $n \\in \\mathbb{N}$.",
    "exemple": "Exemple d'essai : $u_1 = 3$.",
    "simplifie": {
      "coeur": "$u_{n+1} = 2u_n + 1$",
      "moyenMemo": "Moyen mnémotechnique d'essai.",
      "motCle": "essai-alpha",
      "image": "Image mentale d'essai."
    }
  },
  {
    "id": "m-temoin-maths-beta",
    "chapitre": "temoin-maths",
    "notion": "n-temoin-maths-beta",
    "genre": "formule",
    "titre": "Carte d'essai (formule)",
    "enonce": "Énoncé d'essai : $2^{10} = 1024$.",
    "simplifie": {
      "coeur": "$2^{10} = 1024$",
      "motCle": "essai-beta"
    }
  }
]
