[
  {
    "id": "m-vecteurs-espace-colineaires",
    "chapitre": "vecteurs-espace",
    "notion": "n-vecteurs-espace-droites",
    "genre": "propriete",
    "titre": "Vecteurs colinéaires, droites",
    "enonce": "$\\vec{u}$ et $\\vec{v}$ sont colinéaires s'il existe un réel $k$ tel que $\\vec{v} = k\\,\\vec{u}$ ou $\\vec{u} = k\\,\\vec{v}$.\n\n- $M$ est sur la droite passant par $A$ et de vecteur directeur $\\vec{u}$ si et seulement si $\\overrightarrow{AM} = t\\,\\vec{u}$ pour un réel $t$.\n- $A$, $B$, $C$ sont alignés si et seulement si $\\overrightarrow{AB}$ et $\\overrightarrow{AC}$ sont colinéaires.\n- $(AB)$ et $(CD)$ sont parallèles si et seulement si $\\overrightarrow{AB}$ et $\\overrightarrow{CD}$ sont colinéaires.",
    "conditions": "$\\vec{u} \\neq \\vec{0}$ pour diriger une droite ; $A \\neq B$ et $C \\neq D$.",
    "exemple": "$\\overrightarrow{BP} = -2\\,\\overrightarrow{BD}$, donc $B$, $D$, $P$ sont alignés.",
    "simplifie": {
      "coeur": "colinéaires : $\\vec{v} = k\\,\\vec{u}$ ; alignés : $\\overrightarrow{AC} = k\\,\\overrightarrow{AB}$ ; parallèles : $\\overrightarrow{CD} = k\\,\\overrightarrow{AB}$",
      "moyenMemo": "Même point de départ : alignés. Points différents : parallèles.",
      "motCle": "colineaires"
    }
  },
  {
    "id": "m-vecteurs-espace-deux-droites",
    "chapitre": "vecteurs-espace",
    "notion": "n-vecteurs-espace-positions-relatives",
    "genre": "propriete",
    "titre": "Deux droites de l'espace",
    "enonce": "Deux droites de l'espace sont :\n\n- soit coplanaires : sécantes (un seul point commun) ou parallèles (strictement parallèles, ou confondues) ;\n- soit non coplanaires : aucun plan ne les contient ; elles n'ont aucun point commun et ne sont pas parallèles.",
    "conditions": "Sans point commun ne veut pas dire parallèles : vérifie que les vecteurs directeurs sont colinéaires.",
    "exemple": "Dans le cube $ABCDEFGH$ : $(AB)$ et $(HG)$ sont strictement parallèles ; $(AB)$ et $(CG)$ sont non coplanaires.",
    "simplifie": {
      "coeur": "sécantes, parallèles, ou non coplanaires (ni point commun, ni parallèles)",
      "moyenMemo": "Le pont et l'autoroute : ils ne se croisent pas, sans être parallèles.",
      "motCle": "deux-droites",
      "image": "Une autoroute qui passe sous un pont."
    }
  },
  {
    "id": "m-vecteurs-espace-droite-plan-plans",
    "chapitre": "vecteurs-espace",
    "notion": "n-vecteurs-espace-positions-relatives",
    "genre": "propriete",
    "titre": "Une droite et un plan, deux plans",
    "enonce": "- Une droite de vecteur directeur $\\vec{w}$ est parallèle au plan $\\mathcal{P}$ (contenue ou strictement parallèle) si et seulement si $\\vec{w}$ est dans la direction de $\\mathcal{P}$. Sinon, elle coupe $\\mathcal{P}$ en un point.\n- Deux plans sont parallèles (confondus ou strictement parallèles) si et seulement si ils ont la même direction. Sinon, ils sont sécants selon une droite.",
    "conditions": "Pour séparer « contenue » ou « confondus » de « strictement parallèles », cherche un point commun.",
    "exemple": "$\\overrightarrow{EG} = \\overrightarrow{AC}$ et $E$ n'est pas dans le plan $(ABC)$ : la droite $(EG)$ est strictement parallèle au plan $(ABC)$.",
    "simplifie": {
      "coeur": "$d \\parallel \\mathcal{P}$ si et seulement si $\\vec{w} = a\\,\\vec{u} + b\\,\\vec{v}$ ; $\\mathcal{P} \\parallel \\mathcal{P}'$ si et seulement si même direction",
      "moyenMemo": "D'abord les directions, ensuite un point commun.",
      "motCle": "droite-plan"
    }
  },
  {
    "id": "m-vecteurs-espace-base",
    "chapitre": "vecteurs-espace",
    "notion": "n-vecteurs-espace-bases-reperes",
    "genre": "definition",
    "titre": "Base, repère, coordonnées",
    "enonce": "Trois vecteurs $\\vec{i}$, $\\vec{j}$, $\\vec{k}$ non coplanaires forment une base : tout vecteur s'écrit de façon unique $\\vec{u} = x\\,\\vec{i} + y\\,\\vec{j} + z\\,\\vec{k}$, et l'on note $\\vec{u}\\begin{pmatrix} x \\\\ y \\\\ z \\end{pmatrix}$.\n\nDans le repère $\\left(O\\,;\\,\\vec{i}, \\vec{j}, \\vec{k}\\right)$, $M(x\\,;\\,y\\,;\\,z)$ signifie $\\overrightarrow{OM} = x\\,\\vec{i} + y\\,\\vec{j} + z\\,\\vec{k}$.",
    "conditions": "Trois vecteurs coplanaires, même deux à deux non colinéaires, ne forment pas une base.",
    "exemple": "Dans le repère $\\left(A\\,;\\,\\overrightarrow{AB}, \\overrightarrow{AD}, \\overrightarrow{AE}\\right)$ du cube : $G(1\\,;\\,1\\,;\\,1)$, et le milieu de $[FG]$ est $I\\left(1\\,;\\,\\dfrac{1}{2}\\,;\\,1\\right)$.",
    "simplifie": {
      "coeur": "base : 3 vecteurs non coplanaires ; $\\vec{u} = x\\,\\vec{i} + y\\,\\vec{j} + z\\,\\vec{k}$, de façon unique",
      "moyenMemo": "Trois directions qui ne tiennent pas dans un même plan.",
      "motCle": "base",
      "image": "Les trois arêtes d'un cube issues d'un même sommet."
    }
  },
  {
    "id": "m-vecteurs-espace-coordonnees",
    "chapitre": "vecteurs-espace",
    "notion": "n-vecteurs-espace-bases-reperes",
    "genre": "formule",
    "titre": "Calculer avec des coordonnées",
    "enonce": "Pour $A(x_A\\,;\\,y_A\\,;\\,z_A)$ et $B(x_B\\,;\\,y_B\\,;\\,z_B)$ :\n\n- $\\overrightarrow{AB}\\begin{pmatrix} x_B - x_A \\\\ y_B - y_A \\\\ z_B - z_A \\end{pmatrix}$ ;\n- le milieu de $[AB]$ a pour coordonnées $\\left(\\dfrac{x_A + x_B}{2}\\,;\\,\\dfrac{y_A + y_B}{2}\\,;\\,\\dfrac{z_A + z_B}{2}\\right)$ ;\n- pour $\\vec{u} + \\vec{v}$ et $k\\,\\vec{u}$, on ajoute, ou on multiplie par $k$, coordonnée par coordonnée.",
    "conditions": "Deux vecteurs sont égaux si et seulement si leurs trois coordonnées sont égales, dans la même base.",
    "exemple": "$B(1\\,;\\,0\\,;\\,0)$ et $D(0\\,;\\,1\\,;\\,0)$ : $\\overrightarrow{BD}\\begin{pmatrix} -1 \\\\ 1 \\\\ 0 \\end{pmatrix}$.",
    "simplifie": {
      "coeur": "$\\overrightarrow{AB}$ : arrivée moins départ ; milieu : moyenne des coordonnées",
      "moyenMemo": "Arrivée moins départ.",
      "motCle": "coordonnees"
    }
  },
  {
    "id": "m-vecteurs-espace-configurations",
    "chapitre": "vecteurs-espace",
    "notion": "n-vecteurs-espace-configurations",
    "genre": "methode",
    "titre": "Alignés, parallèles, coplanaires",
    "enonce": "| Pour montrer que… | il suffit que… |\n|---|---|\n| $A$, $B$, $C$ alignés | $\\overrightarrow{AC} = k\\,\\overrightarrow{AB}$ |\n| $(AB)$ et $(DE)$ parallèles | $\\overrightarrow{DE} = k\\,\\overrightarrow{AB}$ |\n| $A$, $B$, $C$, $D$ coplanaires | $\\overrightarrow{AD} = a\\,\\overrightarrow{AB} + b\\,\\overrightarrow{AC}$ |\n| $(DE)$ parallèle au plan $(ABC)$ | $\\overrightarrow{DE} = a\\,\\overrightarrow{AB} + b\\,\\overrightarrow{AC}$ |\n\nÉcris tous les vecteurs avec les mêmes vecteurs de référence (relation de Chasles ou coordonnées), compare, puis conclus.",
    "conditions": "$A$, $B$, $C$ non alignés, pour les deux dernières lignes.",
    "exemple": "Tétraèdre $ABCD$, $I$ et $J$ milieux de $[AB]$ et $[BC]$ : $\\overrightarrow{IJ} = \\dfrac{1}{2}\\overrightarrow{AC}$, donc $(IJ)$ est parallèle au plan $(ACD)$.",
    "simplifie": {
      "coeur": "traduire en vecteurs → mêmes vecteurs de référence → comparer → conclure",
      "moyenMemo": "Traduire, décomposer, comparer, conclure.",
      "motCle": "configurations"
    }
  }
]
