[
  {
    "id": "m-trigonometrie-derivees",
    "chapitre": "trigonometrie",
    "notion": "n-trigonometrie-derivees-variations",
    "genre": "formule",
    "titre": "Dérivées de sinus et de cosinus",
    "enonce": "Pour tout réel $x$ : $\\sin'(x) = \\cos(x)$ et $\\cos'(x) = -\\sin(x)$.\n\nPour deux réels $a$ et $b$ : $\\big(\\sin(ax + b)\\big)' = a\\cos(ax + b)$ et $\\big(\\cos(ax + b)\\big)' = -a\\sin(ax + b)$. Plus généralement, pour $u$ dérivable : $\\big(\\sin(u)\\big)' = u'\\cos(u)$ et $\\big(\\cos(u)\\big)' = -u'\\sin(u)$.",
    "conditions": "$x$ en radians ; $u$ dérivable sur un intervalle.",
    "exemple": "$\\big(\\cos(3x)\\big)' = -3\\sin(3x)$ et $\\big(x\\sin(x)\\big)' = \\sin(x) + x\\cos(x)$.",
    "simplifie": {
      "coeur": "$\\sin' = \\cos$ ; $\\cos' = -\\sin$ ; $\\big(\\sin(u)\\big)' = u'\\cos(u)$ ; $\\big(\\cos(u)\\big)' = -u'\\sin(u)$",
      "moyenMemo": "Le signe moins accompagne toujours la dérivée du cosinus.",
      "motCle": "dériver",
      "image": "Dériver, c'est avancer d'un quart de tour, car cos(x) = sin(x + π/2) : sin, puis cos, puis −sin, puis −cos, et on revient à sin."
    }
  },
  {
    "id": "m-trigonometrie-limite-sinus",
    "chapitre": "trigonometrie",
    "notion": "n-trigonometrie-derivees-variations",
    "genre": "formule",
    "titre": "Limite de $\\dfrac{\\sin(x)}{x}$ en $0$",
    "enonce": "$\\lim\\limits_{x \\to 0} \\dfrac{\\sin(x)}{x} = 1$. Preuve par le taux d'accroissement : $\\dfrac{\\sin(x)}{x} = \\dfrac{\\sin(x) - \\sin(0)}{x - 0}$ tend vers le nombre dérivé $\\sin'(0) = \\cos(0) = 1$.\n\nMême idée pour toute forme « $\\dfrac{0}{0}$ » qui s'écrit $\\dfrac{g(x) - g(a)}{x - a}$ : la limite en $a$ est $g'(a)$.",
    "conditions": "$x \\neq 0$, en radians ; $g$ dérivable en $a$.",
    "exemple": "$\\dfrac{\\cos(x) - 1}{x} = \\dfrac{\\cos(x) - \\cos(0)}{x - 0}$ tend vers $\\cos'(0) = -\\sin(0) = 0$.",
    "simplifie": {
      "coeur": "$\\lim\\limits_{x \\to 0} \\dfrac{\\sin(x)}{x} = 1$ : c'est le taux d'accroissement de $\\sin$ en $0$, qui tend vers $\\sin'(0) = \\cos(0) = 1$",
      "moyenMemo": "Près de 0, sin(x) ≈ x : la courbe de sinus colle à sa tangente y = x.",
      "motCle": "taux d'accroissement"
    }
  },
  {
    "id": "m-trigonometrie-cercle",
    "chapitre": "trigonometrie",
    "notion": "n-trigonometrie-equations-inequations",
    "genre": "propriete",
    "titre": "Résoudre $\\cos(x) = a$, $\\sin(x) = a$ ou $\\cos(x) \\leqslant a$ sur $[-\\pi\\,;\\,\\pi]$",
    "enonce": "Si $\\alpha$ est dans $[0\\,;\\,\\pi]$ et $\\cos(\\alpha) = a$, alors sur $[-\\pi\\,;\\,\\pi]$ : $\\cos(x) = a \\iff x = \\alpha$ ou $x = -\\alpha$. Aucune solution si $a < -1$ ou $a > 1$.\n\nPour $\\sin(x) = a$, on prend un autre $\\alpha$ : celui de $\\left[-\\dfrac{\\pi}{2}\\,;\\,\\dfrac{\\pi}{2}\\right]$ tel que $\\sin(\\alpha) = a$. Alors $x = \\alpha$ ou $x = \\pi - \\alpha$, à $2\\pi$ près : si $\\pi - \\alpha$ dépasse $\\pi$, on retranche $2\\pi$. Pour $\\sin(x) = 0$, on ajoute $-\\pi$ : il y a trois solutions, $-\\pi$, $0$ et $\\pi$, car $M(-\\pi) = M(\\pi)$.\n\nPour une inéquation, on trace sur le cercle la droite verticale d'abscisse $a$ : $\\cos(x) \\leqslant a$ à gauche, $\\cos(x) \\geqslant a$ à droite. On lit l'arc de $-\\pi$ à $\\pi$, puis on contrôle avec $x = 0$.\n\nAvec $\\cos(2x)$, on pose $X = 2x$ et on cherche où varie $X$ ; on résout en $X$, puis on revient à $x$.",
    "conditions": "Solutions cherchées dans $[-\\pi\\,;\\,\\pi]$ ; $\\alpha$ choisi dans $[0\\,;\\,\\pi]$ pour $\\cos$, dans $\\left[-\\dfrac{\\pi}{2}\\,;\\,\\dfrac{\\pi}{2}\\right]$ pour $\\sin$.",
    "exemple": "$\\cos(x) \\leqslant \\dfrac{1}{2} \\iff x \\in \\left[-\\pi\\,;\\,-\\dfrac{\\pi}{3}\\right] \\cup \\left[\\dfrac{\\pi}{3}\\,;\\,\\pi\\right]$.",
    "simplifie": {
      "coeur": "$\\cos(x) = \\cos(\\alpha) \\iff x = \\alpha$ ou $x = -\\alpha$ ; $\\sin(x) = \\sin(\\alpha) \\iff x = \\alpha$ ou $x = \\pi - \\alpha$, à $2\\pi$ près (même point du cercle) ; $\\cos(x) \\leqslant a$ : arc à gauche de la droite verticale d'abscisse $a$",
      "moyenMemo": "Cosinus : abscisse, droite verticale. Sinus : ordonnée, droite horizontale.",
      "motCle": "cercle"
    }
  }
]
