[
  {
    "id": "m-acides-bases-couple",
    "chapitre": "acides-bases",
    "notion": "n-acides-bases-reaction",
    "genre": "definition",
    "titre": "Acide, base et couple acide-base",
    "enonce": "Un **acide** est une espèce capable de céder un ion $\\mathrm{H^+}$ ; une **base**, une espèce capable de capter un ion $\\mathrm{H^+}$. Un acide et sa base conjuguée forment un **couple**, noté acide/base, décrit par la demi-équation $\\text{acide} = \\text{base} + \\mathrm{H^+}$.",
    "exemple": "Couple $\\mathrm{CH_3COOH/CH_3COO^-}$ : $\\mathrm{CH_3COOH(aq) = CH_3COO^-(aq) + H^+}$.",
    "simplifie": {
      "coeur": "$\\text{acide} = \\text{base} + \\mathrm{H^+}$",
      "moyenMemo": "L'acide a un atome H de plus que sa base, et une charge plus grande de 1.",
      "motCle": "couple-acide-base"
    }
  },
  {
    "id": "m-acides-bases-equation",
    "chapitre": "acides-bases",
    "notion": "n-acides-bases-reaction",
    "genre": "methode",
    "titre": "Équation d'une réaction acide-base",
    "enonce": "L'acide d'un couple cède un ion $\\mathrm{H^+}$ à la base d'un autre couple. On additionne les demi-équations $\\text{acide}_1 = \\text{base}_1 + \\mathrm{H^+}$ et $\\text{base}_2 + \\mathrm{H^+} = \\text{acide}_2$ : l'ion $\\mathrm{H^+}$ disparaît. Flèche $\\rightarrow$ si la transformation est totale, $\\rightleftarrows$ si elle est non totale.",
    "conditions": "Ions spectateurs écartés ; états physiques indiqués ; éléments et charges conservés.",
    "exemple": "$\\mathrm{CH_3COOH(aq) + HO^-(aq) \\rightarrow CH_3COO^-(aq) + H_2O(\\ell)}$",
    "simplifie": {
      "coeur": "$\\text{acide}_1 + \\text{base}_2 \\rightarrow \\text{base}_1 + \\text{acide}_2$",
      "moyenMemo": "L'ion H⁺ passe d'un couple à l'autre : il n'apparaît jamais dans l'équation.",
      "motCle": "transfert-h"
    }
  },
  {
    "id": "m-acides-bases-ph",
    "chapitre": "acides-bases",
    "notion": "n-acides-bases-ph",
    "genre": "formule",
    "titre": "pH et concentration en ion oxonium",
    "enonce": "$\\mathrm{pH} = -\\mathrm{log}\\left(\\dfrac{[\\mathrm{H_3O^+}]}{c^\\circ}\\right)$ et, inversement, $[\\mathrm{H_3O^+}] = c^\\circ \\times 10^{-\\mathrm{pH}}$, avec $c^\\circ = 1\\ \\mathrm{mol \\cdot L^{-1}}$, la concentration standard. Le pH n'a pas d'unité.\n\nRappel : $y = \\mathrm{log}(x)$ signifie $x = 10^y$.",
    "conditions": "Solution aqueuse diluée ; $[\\mathrm{H_3O^+}]$ en $\\mathrm{mol \\cdot L^{-1}}$.",
    "exemple": "$[\\mathrm{H_3O^+}] = 2{,}5 \\times 10^{-3}\\ \\mathrm{mol \\cdot L^{-1}}$ donne $\\mathrm{pH} = 2{,}60$ ; $\\mathrm{pH} = 2{,}50$ donne $[\\mathrm{H_3O^+}] \\approx 3{,}2 \\times 10^{-3}\\ \\mathrm{mol \\cdot L^{-1}}$.",
    "simplifie": {
      "coeur": "$\\mathrm{pH} = -\\mathrm{log}([\\mathrm{H_3O^+}]/c^\\circ)$ ; $[\\mathrm{H_3O^+}] = c^\\circ \\times 10^{-\\mathrm{pH}}$",
      "moyenMemo": "Plus d'ions oxonium, pH plus petit.",
      "motCle": "ph",
      "image": "Une échelle où chaque pas vaut un facteur 10 : pH 2, 3, 4 pour 10⁻², 10⁻³, 10⁻⁴ mol·L⁻¹."
    }
  },
  {
    "id": "m-acides-bases-calcul-ph",
    "chapitre": "acides-bases",
    "notion": "n-acides-bases-ph",
    "genre": "methode",
    "titre": "Calculer un pH : arrondi et contrôle",
    "enonce": "- Le pH a autant de décimales que $[\\mathrm{H_3O^+}]$ a de chiffres significatifs, et inversement.\n- Contrôle : si $[\\mathrm{H_3O^+}]$ est comprise entre $10^{-3}$ et $10^{-2}\\ \\mathrm{mol \\cdot L^{-1}}$, le pH est compris entre 2 et 3.\n- Diviser $[\\mathrm{H_3O^+}]$ par 10 augmente le pH de 1.",
    "exemple": "$[\\mathrm{H_3O^+}] = 4{,}0 \\times 10^{-4}\\ \\mathrm{mol \\cdot L^{-1}}$ (2 chiffres significatifs) : $\\mathrm{pH} = 3{,}40$ (2 décimales), bien compris entre 3 et 4.",
    "simplifie": {
      "coeur": "Décimales du pH = chiffres significatifs de $[\\mathrm{H_3O^+}]$ ; $[\\mathrm{H_3O^+}]$ divisée par 10 : pH augmenté de 1",
      "moyenMemo": "La partie entière du pH repère la puissance de dix ; les décimales portent la précision.",
      "motCle": "arrondi-ph"
    }
  },
  {
    "id": "m-acides-bases-couples-usuels",
    "chapitre": "acides-bases",
    "notion": "n-acides-bases-couples-usuels",
    "genre": "definition",
    "titre": "Les couples acide-base à connaître",
    "enonce": "- Eau : $\\mathrm{H_3O^+/H_2O}$ et $\\mathrm{H_2O/HO^-}$.\n- Acide carbonique : $\\mathrm{(CO_2,H_2O)/HCO_3^-}$ et $\\mathrm{HCO_3^-/CO_3^{2-}}$.\n- Acide carboxylique / ion carboxylate : $\\mathrm{R{-}COOH/R{-}COO^-}$.\n- Ion ammonium / amine : $\\mathrm{R{-}NH_3^+/R{-}NH_2}$.",
    "exemple": "Acide éthanoïque / ion éthanoate : $\\mathrm{CH_3COOH/CH_3COO^-}$. Ion méthylammonium / méthylamine : $\\mathrm{CH_3{-}NH_3^+/CH_3{-}NH_2}$.",
    "simplifie": {
      "coeur": "$\\mathrm{H_3O^+/H_2O}$ ; $\\mathrm{H_2O/HO^-}$ ; $\\mathrm{(CO_2,H_2O)/HCO_3^-}$ ; $\\mathrm{HCO_3^-/CO_3^{2-}}$ ; $\\mathrm{R{-}COOH/R{-}COO^-}$ ; $\\mathrm{R{-}NH_3^+/R{-}NH_2}$",
      "moyenMemo": "Dans chaque couple, l'acide est à gauche du « / » : il a un atome H de plus que sa base.",
      "motCle": "couples-usuels"
    }
  },
  {
    "id": "m-acides-bases-lewis",
    "chapitre": "acides-bases",
    "notion": "n-acides-bases-couples-usuels",
    "genre": "methode",
    "titre": "Schémas de Lewis : ion carboxylate et ion ammonium",
    "enonce": "- De l'acide carboxylique à l'ion carboxylate : la liaison $\\mathrm{O{-}H}$ disparaît et son doublet reste sur l'oxygène. Cet O porte alors 3 doublets non liants et la charge $\\ominus$ (7 électrons pour 6 de valence).\n- De l'amine à l'ion ammonium : le doublet non liant de l'azote devient une liaison $\\mathrm{N{-}H}$. L'azote porte alors 4 liaisons et la charge $\\oplus$ (4 électrons pour 5 de valence).",
    "exemple": "Acide éthanoïque $\\mathrm{CH_3{-}COOH}$ et ion éthanoate $\\mathrm{CH_3{-}COO^-}$ ; méthylamine $\\mathrm{CH_3{-}NH_2}$ et ion méthylammonium $\\mathrm{CH_3{-}NH_3^+}$ (figures du cours).",
    "simplifie": {
      "coeur": "$\\mathrm{R{-}COO^-}$ : un O à 3 doublets non liants et $\\ominus$. $\\mathrm{R{-}NH_3^+}$ : N à 4 liaisons, sans doublet non liant, et $\\oplus$.",
      "moyenMemo": "H⁺ part sans électron : il laisse le doublet de la liaison sur l'atome qu'il quitte.",
      "motCle": "lewis"
    }
  },
  {
    "id": "m-acides-bases-amphotere",
    "chapitre": "acides-bases",
    "notion": "n-acides-bases-amphotere",
    "genre": "definition",
    "titre": "Espèce amphotère",
    "enonce": "Une espèce amphotère est l'acide d'un couple acide-base et la base d'un autre couple : selon l'espèce qu'elle rencontre, elle cède ou capte un ion $\\mathrm{H^+}$.",
    "exemple": "L'eau, dans $\\mathrm{H_3O^+/H_2O}$ et $\\mathrm{H_2O/HO^-}$ ; l'ion hydrogénocarbonate, dans $\\mathrm{(CO_2,H_2O)/HCO_3^-}$ et $\\mathrm{HCO_3^-/CO_3^{2-}}$.",
    "simplifie": {
      "coeur": "Amphotère = acide d'un couple et base d'un autre",
      "moyenMemo": "Du grec amphoteros, « l'un et l'autre ».",
      "motCle": "amphotere",
      "image": "La même espèce se trouve à droite du « / » dans un couple et à gauche dans un autre."
    }
  }
]
