[
  {
    "id": "m-equations-espace-representation-parametrique",
    "chapitre": "equations-espace",
    "notion": "n-equations-espace-representation-parametrique",
    "genre": "formule",
    "titre": "Représentation paramétrique d'une droite",
    "enonce": "La droite passant par $A(x_A\\,;\\,y_A\\,;\\,z_A)$ et de vecteur directeur $\\vec{u}\\begin{pmatrix} a \\\\ b \\\\ c \\end{pmatrix}$ a pour représentation paramétrique\n\n$$\\begin{cases} x = x_A + ta \\\\ y = y_A + tb \\\\ z = z_A + tc \\end{cases} \\quad t \\in \\mathbb{R}.$$\n\nChaque réel $t$ donne un point de la droite ; $t = 0$ donne $A$. Inversement, sur un tel système, les nombres seuls donnent un point et les coefficients de $t$ un vecteur directeur.",
    "conditions": "$\\vec{u} \\neq \\vec{0}$. Une droite a une infinité de représentations paramétriques : autre point, autre vecteur directeur colinéaire.",
    "exemple": "$A(1\\,;\\,-2\\,;\\,3)$ et $\\vec{u}\\begin{pmatrix} 2 \\\\ 1 \\\\ -1 \\end{pmatrix}$ : $x = 1 + 2t$, $y = -2 + t$, $z = 3 - t$, avec $t \\in \\mathbb{R}$.",
    "simplifie": {
      "coeur": "$x = x_A + ta$, $y = y_A + tb$, $z = z_A + tc$, $t \\in \\mathbb{R}$",
      "moyenMemo": "Nombres seuls : le point. Devant t : le vecteur.",
      "motCle": "parametrique",
      "image": "Un drone qui avance du même vecteur à chaque seconde."
    }
  },
  {
    "id": "m-equations-espace-point-sur-droite",
    "chapitre": "equations-espace",
    "notion": "n-equations-espace-representation-parametrique",
    "genre": "methode",
    "titre": "Tester si un point est sur une droite",
    "enonce": "On remplace $x$, $y$, $z$ par les coordonnées du point dans la représentation paramétrique, puis on tire $t$ de chacune des trois égalités. Le point est sur la droite si et seulement si les trois égalités donnent la même valeur de $t$.",
    "exemple": "$d : x = 1 + t$, $y = 2t$, $z = 3 - t$. Pour $M(4\\,;\\,6\\,;\\,1)$ : $t = 3$, $t = 3$, puis $t = 2$. $M$ n'est pas sur $d$.",
    "simplifie": {
      "coeur": "Même $t$ dans les trois égalités $\\iff$ point sur la droite",
      "moyenMemo": "Deux égalités ne suffisent pas : teste toujours la troisième.",
      "motCle": "meme-parametre"
    }
  },
  {
    "id": "m-equations-espace-equation-plan",
    "chapitre": "equations-espace",
    "notion": "n-equations-espace-equation-plan",
    "genre": "formule",
    "titre": "Équation cartésienne d'un plan",
    "enonce": "Le plan passant par $A(x_A\\,;\\,y_A\\,;\\,z_A)$ et de vecteur normal $\\vec{n}\\begin{pmatrix} a \\\\ b \\\\ c \\end{pmatrix}$ a pour équation $a(x - x_A) + b(y - y_A) + c(z - z_A) = 0$, de la forme $ax + by + cz + d = 0$ ; on trouve $d$ en écrivant que $A$ la vérifie.\n\nInversement, si $a$, $b$, $c$ ne sont pas tous nuls, $ax + by + cz + d = 0$ est l'équation d'un plan de vecteur normal $\\vec{n}\\begin{pmatrix} a \\\\ b \\\\ c \\end{pmatrix}$.",
    "conditions": "Repère orthonormé ; $\\vec{n} \\neq \\vec{0}$.",
    "exemple": "$A(1\\,;\\,2\\,;\\,-1)$ et $\\vec{n}\\begin{pmatrix} 2 \\\\ -1 \\\\ 3 \\end{pmatrix}$ : $2x - y + 3z + d = 0$ et $2 - 2 - 3 + d = 0$, donc $d = 3$.",
    "simplifie": {
      "coeur": "$\\vec{n}\\begin{pmatrix} a \\\\ b \\\\ c \\end{pmatrix}$ normal : $ax + by + cz + d = 0$, avec $d$ trouvé grâce à un point du plan",
      "moyenMemo": "Les coefficients de x, y, z forment le vecteur normal.",
      "motCle": "cartesienne",
      "image": "Un mât planté droit dans un sol plat : le vecteur normal."
    }
  },
  {
    "id": "m-equations-espace-verifier-plan",
    "chapitre": "equations-espace",
    "notion": "n-equations-espace-equation-plan",
    "genre": "methode",
    "titre": "Vérifier qu'une équation est celle du plan $(ABC)$",
    "enonce": "On montre que $A$, $B$, $C$ ne sont pas alignés, car $\\overrightarrow{AB}$ et $\\overrightarrow{AC}$ ne sont pas colinéaires. Puis on vérifie que les coordonnées des trois points satisfont l'équation. Un seul plan passe par trois points non alignés : c'est donc une équation du plan $(ABC)$.",
    "exemple": "Dans le cube d'arête $1$ : $B(1\\,;\\,0\\,;\\,0)$, $D(0\\,;\\,1\\,;\\,0)$ et $G(1\\,;\\,1\\,;\\,1)$, non alignés, vérifient $x + y - z - 1 = 0$ : c'est une équation du plan $(BDG)$.",
    "simplifie": {
      "coeur": "$A$, $B$, $C$ non alignés et vérifient l'équation $\\Rightarrow$ c'est une équation de $(ABC)$",
      "moyenMemo": "Trois points non alignés, trois tests.",
      "motCle": "verifier-plan"
    }
  },
  {
    "id": "m-equations-espace-projete-plan",
    "chapitre": "equations-espace",
    "notion": "n-equations-espace-projete",
    "genre": "methode",
    "titre": "Projeté orthogonal sur un plan donné par une équation",
    "enonce": "Pour le projeté $H$ de $M$ sur le plan $ax + by + cz + d = 0$ : on écrit la droite $\\Delta$ passant par $M$ et dirigée par $\\vec{n}\\begin{pmatrix} a \\\\ b \\\\ c \\end{pmatrix}$, on remplace $x$, $y$, $z$ dans l'équation du plan, on résout en $t$, puis on remet $t$ dans $\\Delta$. La distance de $M$ au plan est $MH$.",
    "conditions": "Repère orthonormé. La distance est la longueur $MH$, pas la valeur de $t$.",
    "exemple": "$O$ et le plan $2x + y + z - 4 = 0$ : $\\Delta$ : $x = 2t$, $y = t$, $z = t$, puis $6t - 4 = 0$, $t = \\dfrac{2}{3}$ et $H\\left(\\dfrac{4}{3}\\,;\\,\\dfrac{2}{3}\\,;\\,\\dfrac{2}{3}\\right)$.",
    "simplifie": {
      "coeur": "$\\Delta$ : $x = x_M + ta$, $y = y_M + tb$, $z = z_M + tc$, reportée dans l'équation du plan : on trouve $t$, puis $H$",
      "moyenMemo": "Le fil à plomb suit le vecteur normal.",
      "motCle": "projete-plan",
      "image": "Un fil à plomb qui tombe de M et touche le plan en H."
    }
  },
  {
    "id": "m-equations-espace-projete-droite",
    "chapitre": "equations-espace",
    "notion": "n-equations-espace-projete",
    "genre": "methode",
    "titre": "Projeté orthogonal sur une droite",
    "enonce": "Pour le projeté $H$ de $M$ sur la droite passant par $B$ et dirigée par $\\vec{u}$ : on écrit les coordonnées de $H$ en fonction de $t$ avec une représentation paramétrique, puis on résout $\\overrightarrow{MH} \\cdot \\vec{u} = 0$. $H$ est le point de la droite le plus proche de $M$.",
    "conditions": "Repère orthonormé ; $\\vec{u} \\neq \\vec{0}$.",
    "exemple": "$d : x = 1 + t$, $y = 2$, $z = t$ et $A(3\\,;\\,1\\,;\\,4)$ : $\\overrightarrow{AH} \\cdot \\vec{u} = 2t - 6 = 0$, donc $t = 3$, $H(4\\,;\\,2\\,;\\,3)$ et $AH = \\sqrt{3}$.",
    "simplifie": {
      "coeur": "$H$ en fonction de $t$, puis $\\overrightarrow{MH} \\cdot \\vec{u} = 0$",
      "moyenMemo": "Une équation, une inconnue : t.",
      "motCle": "projete-droite"
    }
  },
  {
    "id": "m-equations-espace-droite-plan",
    "chapitre": "equations-espace",
    "notion": "n-equations-espace-intersections",
    "genre": "propriete",
    "titre": "Une droite et un plan, deux plans",
    "enonce": "**Droite et plan** : on remplace la représentation paramétrique dans l'équation du plan, et l'on obtient $\\alpha t + \\beta = 0$. Si $\\alpha \\neq 0$ : un seul point commun. Si $\\alpha = 0$ et $\\beta \\neq 0$ : droite strictement parallèle au plan. Si $\\alpha = 0$ et $\\beta = 0$ : droite contenue dans le plan.\n\n**Deux plans** : vecteurs normaux colinéaires, plans parallèles (confondus s'ils ont un point commun) ; sinon, plans sécants selon une droite. Ils sont perpendiculaires si $\\vec{n} \\cdot \\vec{n}' = 0$.",
    "exemple": "$x + y + z - 6 = 0$ et $x = 1 + t$, $y = 2 - t$, $z = 3t$ : $3t - 3 = 0$, donc $t = 1$ et le point commun est $(2\\,;\\,1\\,;\\,3)$.",
    "simplifie": {
      "coeur": "Droite et plan : $\\alpha t + \\beta = 0$ (une solution, aucune, toutes). Deux plans : $\\vec{n}$, $\\vec{n}'$ colinéaires $\\iff$ parallèles ; $\\vec{n} \\cdot \\vec{n}' = 0$ $\\iff$ perpendiculaires",
      "motCle": "droite-plan"
    }
  },
  {
    "id": "m-equations-espace-deux-droites",
    "chapitre": "equations-espace",
    "notion": "n-equations-espace-intersections",
    "genre": "methode",
    "titre": "Deux droites : sécantes ou non coplanaires ?",
    "enonce": "On donne deux paramètres différents, $t$ et $s$. Si les vecteurs directeurs sont colinéaires, les droites sont parallèles. Sinon, on écrit l'égalité des trois coordonnées, on résout deux équations, puis on teste la troisième : vérifiée, les droites sont sécantes ; non vérifiée, elles sont non coplanaires.",
    "exemple": "$1 + t = 3 - s$, $2t = 2s$ et $-1 + t = -2 + 2s$ : les deux premières donnent $t = s = 1$, la troisième est vérifiée ; le point commun est $(2\\,;\\,2\\,;\\,0)$.",
    "simplifie": {
      "coeur": "Paramètres $t$ et $s$ ; résoudre deux équations, tester la troisième",
      "moyenMemo": "Deux lettres, deux équations, un test.",
      "motCle": "deux-droites"
    }
  }
]
